"id","txt","created_utc","corpus","match_first","TARGET","CCONJ","comma","match","ADJ","TARGET_mod","ADV","first"
"g38drsr","the stock switches on both are 10m omrons. If you want something feeling similar but better you can try the 20m (OF) omrons. These are quite well like and apparently pretty sturdy as well.

TTC Gold is very stiff and sounds terrible. The JP Omrons are way lighter if you like that. There are also other options like honeywell switches that are similar to JP Omrons. Super light and quiet but could be prone to mis clicks I guess.

I havent tried gm8.0 yet but it is supposed to be lighter than 4 and similar to stock omrons but from what I have seen the sound is different. Like none of kailh switches sound as good as omron imo if that's important to you.  I'd try 20m (OF), they are cheaper than other options as well and pretty good and feel like stock.",1598701512,"super light and quiet but could be prone to mis clicks i guess.","light and quiet","quiet",NA,FALSE,"light and quiet","light",NA,NA,0
"g38624l","Around Preston Park is nice and quiet too, if you avoid the Preston circus end. If there’s anything on the market around Preston park station that’s a nice part of town to live in, I did for many years. Quiet but close enough to town to walk to work/meet up with friends etc",1598693572,"around preston park is nice and quiet too, if you avoid the preston circus end.","nice and quiet","quiet",NA,FALSE,"nice and quiet","nice",NA,NA,0
"g37sx82","I prefer cats because they don't bark and are clean. I'm a programmer so I need peace and quiet but also occasional companionship from a fluffy creature.",1598680674,"i'm a programmer so i need peace and quiet but also occasional companionship from a fluffy creature.","peace and quiet","quiet",NA,FALSE,"quiet but also occasional","occasional",NA,"also",1
"g37jq5x","There's so many great moments in this chapter, Shiggy broke his jaws and looked like a zombie, Bakugou managed to blew away the other bullet, Aizawa the MVP who acted rationally and cut of his leg with no hesitation. But can we take a moment appreciate my boy Deku uses Black Whip as splint for his arm after he broke it with 100%? That's such a cool and badass way of using his power.

And that last panel, it gave me so much chills, how can something look so peaceful and quiet, but also terrifying and despairing at the same time? It gave me an old-school Godzilla vibe.",1598673629,"and that last panel, it gave me so much chills, how can something look so peaceful and quiet, but also terrifying and despairing at the same time?","peaceful and quiet","quiet",NA,FALSE,"so peaceful and quiet","peaceful",NA,"so",0
"g37j98c","My siblings and I are like watching a level of support gradient and it's fucking trippy. 

Me, the oldest: My parents were young when they had me so I got the brunt of the neglect and abuse. My dad resented me, couldn't tell the difference between physical abuse and discipline because of how he'd been raised, was often abusive to my mom in front of me, constantly made disparaging comments about me especially in public, and I was excluded from and actively prevented from learning any sort of basic skill on my own. The skills I did learn were behind my parents' back, and I never talked to them about any of it because they'd already destroyed my desire to practice art with their apathy or outright criticism.

I'm almost 28 and have just now gotten to a point where I'm standing on my own two feet. I still lack confidence in things most people already know how to do. I'm working a dead end job that I hate. I never went to college due to a lack of financial or emotional support. Every relationship I've had that wasn't long distance has been generally toxic or abusive, which I'm finally taking a step back and reevaluating what lead me to get into those situations and what red flags I shouldn't be brushing off in the future. I feel like I'm at a point I should have been at several years ago and I've lost so much time.

First brother: Suffered physical and emotional abuse growing up, but had the endless support of the family. He was actively taught several skills at a young age (how to save money, the value of hard work via getting paid a small amount for good grades, how to work on cars, various aspects of ranch life, ect.) Was never threatened with rent while living at home or otherwise encouraged to move out. My dad and grandparents helped him buy his first car. They encouraged him to take college classes and made the effort to do their part of the paperwork.

He still lives at home at 24. He's learned several skills that he's working on putting to use. He goes on trips out of state a few times a year and my parents don't bat an eye (my dad threatened me with rent and accused me of losing motivation and staying on his couch because I took a single week vacation to California to refresh after getting out of an abusive relationship that left me homeless. I had a decently paying job and was saving money less than a month after moving back home.) Overall, you can tell he's been through some shit due to how softspoken he can be, but he's got a drive that I don't have.

Second brother: Got the tail end of the abuse when it had really started calming down. He's got some childhood triggers and is rather sensitive and quiet, but he's very sure of himself and confident. He's hardworking and I can tell he's going to navigate life pretty well as he gets older.

Baby sister: Got none of the abuse as far as I know because I scared my dad into not ever doing to her what he did to me. She's extroverted, extremely confident, knows what she wants and isn't afraid to try new things or meet new people. She's pretty fearless and incredibly talented for her age already. I worry about her becoming arrogant or overly confident as opposed to failing or being afraid of life in general.",1598673309,"he's got some childhood triggers and is rather sensitive and quiet, but he's very sure of himself and confident.","sensitive and quiet","quiet",NA,FALSE,"rather sensitive and quiet","sensitive",NA,"rather",0
"g37hv2q","I had a Kobalt and it sucks, battery won't stay connected so it dies on a good bump, batteries don't last long, even the long run one. Was nice that it was light and quiet, but that was about it.

Recently switched to EGO: self-propelled, sturdier, and did my whole yard in half a battery. Batteries charge faster (charger even has to have a built-in cooling fan) too, and look more like pic #2... Also it easily folds up for storage. I'm half looking forward to busting out the EGO snowblower this winter.",1598672380,"was nice that it was light and quiet, but that was about it.","light and quiet","quiet",NA,FALSE,"light and quiet","light",NA,NA,0
"g37gf9c","Finding food is hard, you need to know the right way to have enough food and water to survival. Mainly, there is 3 ways on it.

1.Searching in the city

There are lots of sealed food can and water bottle you may found in the city. If you keep searching, you may have chance to survival. However, there is lots of zombies in the city too.

For this reason, you may need to know how to fight zombies. Gun is good, but it is loud, and it will attract more zombies everytime you shoot. Bow or melee is quiet, but hard to kill zombies if you are not good at it.

The other way is stealth, most of the zombie only have average sight, which means if you think yourself have a good perception, you may try to search the city at night, and left before sun rise.

This is high risk low return way to survival, which we do not recommend you to do it.

2.Hunting in the wild

Thanks to zombies do not like to move around, hiding in the wild is a good way to escape from those terrible zombies. However food is hard to find if you do not know what you are looking for.

Hunting is a good way to find food. You may want to train yourself to use bow and arrow to hunt, as ammo is near impossible to found in wild. Some melee expert will try to hunt with their hand, hoove or sword. However this will limit their food resource on boar or wolf. Remember you need to build smoking rack at soon as possible, as meat cannot keep more than a day.

The number of wild animal will recover when give them enough time, and it is not a short time. It means you need to go further and further from your base just for hunting more food when time past.

It is a tired way to survival, which we do not recommend you to do it.

3.Join and become Mycus

As you become Mycus, we will reward you a easy and infinite food resource. You do not need to worry about not enough food, you do not need to worry about water is clean or not. This is our food for you, the newcomers on Earth, Mycus fruit.

Mycus fruit is easy to found in our biospheres, easy to carry and safe to eat even you do not cook the fruit. It is tasty and make you happy everyday, as the fruit is design for our newcomers on Earth. Moreover, it will not spoiled.

As we have enough food, life is much more easier. We may choose a better way to become stronger. We may stay in the same place and read books for month, to gain enough skills to protect us from those zombies. We may go to search the city for more resource slowly, as we do not need to rush for food.

It is the best way to survival in this cataclysm, we recommend you to join us.",1598671445,"bow or melee is quiet, but hard to kill zombies if you are not good at it.","quiet, but hard","quiet","but",TRUE,"quiet , but hard","hard",NA,NA,1
"g37cwyv","LED lights set to deep red? ""Turn On The Bright Lights"" playing? A quiet but comfortable Friday night? Sounds ideal",1598669243,"a quiet but comfortable friday night?","quiet but comfortable","quiet","but",FALSE,"quiet but comfortable","comfortable",NA,NA,1
"g373wei","Lacari was the Hype Man
Mang0 was the Quiet but Reliable Man
Mizkif was the School Nerd that no one hangs out with.
Clint was the ultimate hero and always won for the crown.

Honestly they were all good they did so many perfect games that I just can't help to be amazed.",1598663783,"lacari was the hype man mang0 was the quiet but reliable man mizkif was the school nerd that no one hangs out with.","quiet but reliable","quiet","but",FALSE,"quiet but reliable","reliable",NA,NA,1
"g2kp2pw","What I meant is that I wouldn't like the difference between loud and quiet to be too great, so that, when listening with a constant volume, the loud parts would be loud, but not too loud, and the quiet parts would be quiet, but not too quiet. How would I go about that in Premiere? Is the ""dynamics"" audio effect the best option for preserving audio quality?",1598182406,"what i meant is that i wouldn't like the difference between loud and quiet to be too great, so that, when listening with a constant volume, the loud parts would be loud, but not too loud, and the quiet parts would be quiet, but not too quiet.","loud and quiet","quiet",NA,FALSE,"loud and quiet","loud",NA,NA,0
"g2klv6r","I use [white rain](https://mynoise.net/NoiseMachines/whiteRainNoiseGenerator.php) with a bit of the [aural scan](https://mynoise.net/NoiseMachines/auralScannerNoiseGenerator.php). Put the aural scan to ""alert"" and then I normally have quiet but just loud enough to here it faintly.

The aural scan one might be distracting at first, but I found it really helped me focus once it just sits in the background without a lot of attention. There's meant to be some science behind its concentration benefits but I can't remember them exactly.",1598180023,"put the aural scan to ""alert"" and then i normally have quiet but just loud enough to here it faintly.","quiet but just","quiet","but",FALSE,"quiet but just loud","loud",NA,"just",1
"g2kj04o","The Ryzens' stock coolers do a decent job, to be honest. Not very quiet, but more than adequate.

The 115i should be able to keep the CPU thermals in check. That almost sounds like it's not moving water at all (i.e. the pump is dead, disconnected or getting a zero pwm signal).",1598177554,"not very quiet, but more than adequate.","quiet, but more","quiet","but",TRUE,"very quiet , but more","more","very",NA,1
"g2keubm","Be quiet, but strong ...",1598172946,"be quiet, but strong ...","quiet, but strong","quiet","but",TRUE,"quiet , but strong","strong",NA,NA,1
"g2kczq5","This. It's why I have a UHD BR player and people always ask me why I still use physical discs. Then I throw on the first 5 minutes of Mad Max FR, Bladerunner 2049 or Ready Player One, then stream something from Netflix or Amazon Prime. Watching their reactions is like Neo when he starts to believe. All of the dynamics and 'cinema sound' gone in an instant. 

I remember I bought the Incredibles 2 as an UHD Prime Video purchase and the film itself was great, but the audio was awful. The sound mixing and leveling was awful and sounded really flat - no weight or depth to the sound where there should be great dynamics and earth shaking bass. On top of that, it did that awful thing where vocals were really quiet but atmospheric sounds and bgm were really loud. It really ruined the experience for me.",1598170930,"on top of that, it did that awful thing where vocals were really quiet but atmospheric sounds and bgm were really loud.","quiet but atmospheric","quiet","but",FALSE,"really quiet but atmospheric","atmospheric","really",NA,1
"g2k9bmh","“Gave a decent tip...nice and quiet but his voice kinda sucked...7/10”",1598167142,"“gave a decent tip...nice and quiet but his voice kinda sucked...7/10”","nice and quiet","quiet",NA,FALSE,"nice and quiet","nice",NA,NA,0
"g2k65pw","Yeah, apparently two guests that came in together got into an argument with him (idk what for), got in his face, and then one of them hit him in the head with a cylinder of wipes. When he straightened up the other one pushed him super hard into the flat, then they both ran out. It was two young girls (I think 18-25 old) too. Super weird because he is a quiet, but pretty scary looking dude. I don’t think they hit him hard, but I’m sure he was caught off guard. I hope he sues.",1598164101,"super weird because he is a quiet, but pretty scary looking dude.","quiet, but pretty","quiet","but",TRUE,"quiet , but pretty scary","scary",NA,"pretty",1
"g2k27ux","This is awesome. Feel free to come to East Lansing and do it as well. East Lansing frat houses are quiet but most of the houses are having parties. They seem to be following the 25 person rule though",1598160612,"east lansing frat houses are quiet but most of the houses are having parties.","quiet but most","quiet","but",FALSE,"quiet but most","most",NA,NA,1
"g2jxfiw","Asked her to the movies for my birthday as a date. Got there a few minutes early and stand out front of the theater for a while to wait for her. 15 minutes later and the movie is going to start soon. She’s late, but no big deal I’m more interested in spending time with her than the movie itself. Two girls that had been talking amongst themselves near me walk up and ask if I’d like to go watch a movie with them. Dumbfounded due to my low self esteem at the time, I managed a quiet but polite apology and explained I was waiting for my date. (I obviously regretted this later) The girl I’m waiting for shows up half an hour late with two other guys in tow and proceeds to practically ignore me while flirting with both of them.",1598156799,"dumbfounded due to my low self esteem at the time, i managed a quiet but polite apology and explained i was waiting for my date.","quiet but polite","quiet","but",FALSE,"quiet but polite","polite",NA,NA,1
"g1x5jrp","Test depth isn't the only factor to consider when deciding if something a threat.
Here's a cool article comparing the VA class to the Akula class with some good points as to what technologies go into submarines:
https://www.naval-technology.com/features/featurebattle-of-the-submarines-akula-versus-virginia/#:~:text=The%20Virginia-class%20submarines%20have,sailing%20on%20the%20water's%20surface

If the submarine can reach that depth, there's a few ways it can be a threat.  For starters it's harder to detect submarines the deeper they are. Sound travels differently throughout the ocean based on salinity and temperature, which can change drastically at different depths around the world. Sound is one of the main ways submarines (and microphone buoys) track foreign submarines. Thermoclines can change the way sound is reflected, making submarines effectively invisible. 
https://www.google.com/amp/s/theconversation.com/amp/how-to-find-a-submarine-no-its-not-just-a-case-of-flicking-the-sonar-on-33343
Why a military would spend all of that budget on hull structure and materials to withstand massive depths instead of making a quieter submarine (like Gotland class, super quiet but fairly shallow) who knows. Usually speed and sound are much more important factors than pure depth but who knows. Any extra depth means more materials, means more money. Silence is a benefit at any depth. 
Another reason is the obvious run away/hide where the enemy submarines can't go. Thats assuming the VA class test depth (current opponent sub, info available on Wikipedia) is accurate at just barely outpacing the world freediving record.
Unless the Losharik also has weapons available at that depth it will still need to rise to a depth shallow enough to launch an attack, negating any stealth gained by being so deep.
https://www.popularmechanics.com/military/weapons/a25176/launching-missile-from-submarine/
Assuming there's no com systems able to reach 2600m they would need to rise for that too. Periscope depth is the most vulnerable time on a submarine. All it takes is one good detection for an enemy to be able to tune into that frequency and track the sub across various depths.",1597703576,"thermoclines can change the way sound is reflected, making submarines effectively invisible.  https://www.google.com/amp/s/theconversation.com/amp/how-to-find-a-submarine-no-its-not-just-a-case-of-flicking-the-sonar-on-33343 why a military would spend all of that budget on hull structure and materials to withstand massive depths instead of making a quieter submarine (like gotland class, super quiet but fairly shallow) who knows.","quiet but fairly","quiet","but",FALSE,"super quiet but fairly shallow","shallow","super","fairly",1
"g1x3nx5","Quit my job, tell no one, and live a quiet but luxurious life",1597702652,"quit my job, tell no one, and live a quiet but luxurious life","quiet but luxurious","quiet","but",FALSE,"quiet but luxurious","luxurious",NA,NA,1
"g1x19vy","Mostly stuff about how the Kinkou interact with each other: the tension but caring between Shen and Akali, the fun games between Kennen and Akali and the quiet but wise talks between Shen and Kennen. Those are the most fun.

Also Amumu eventually finds a friend ):",1597701492,"mostly stuff about how the kinkou interact with each other: the tension but caring between shen and akali, the fun games between kennen and akali and the quiet but wise talks between shen and kennen.","quiet but wise","quiet","but",FALSE,"quiet but wise","wise",NA,NA,1
"g1wqp85","Very quiet but annoying, you will see kids almost everywhere and run down the street, it makes me want to just pick one up and kick it across the street",1597697556,"very quiet but annoying, you will see kids almost everywhere and run down the street, it makes me want to just pick one up and kick it across the street","quiet but annoying","quiet","but",FALSE,"very quiet but annoying","annoying","very",NA,1
"g1w4yhh","The B550M Mortar is great, if it's cheaper than ASRock boards I'd definitely go for that.

I had the MSI Gaming X 5700XT. Great card, ran cool and quiet, but I've always had bad luck with AMD drivers. Between the Gigabyte OC or Sapphire Pulse I'd go with the Gigabyte because it has a triple fan cooler, which generally means it'll run cooler. Though if it was my choice, it'd be between the Sapphire Nitro or the MSI Gaming X.

If you want a minor OC, look at the eSports 34 Duo, NH-U12S/NH-U14S, or Dark Rock 4.",1597689733,"great card, ran cool and quiet, but i've always had bad luck with amd drivers.","cool and quiet","quiet",NA,FALSE,"cool and quiet","cool",NA,NA,0
"g1w010c","I'll just repost what I replied above because think it's the same line.

&gt; Comes down to game theory as IssacArthur has talked about in his vids on youtube. It's safer to just stay quiet. But he hates the idea heh. He also makes a good point that if we stay quiet and alien contact is benevolent we still live in the quiet scenario but get no benefit. So yeah you have to factor in the reward for true game theory and the reward of contacting a benevolent race might outweigh everything after crunching the probabilities of scenarios based on action. But again if that race is so powerful, it would just find us on our own sitting quietly so again say quiet still best?",1597687522,"he also makes a good point that if we stay quiet and alien contact is benevolent we still live in the quiet scenario but get no benefit.","quiet and alien","quiet",NA,FALSE,"quiet and alien","alien",NA,NA,1
"g1vzv36","Comes down to game theory as IssacArthur has talked about in his vids on youtube.   It's safer to just stay quiet.  But he hates the idea heh.  He also makes a good point that if we stay quiet and alien contact is benevolent we still live in the quiet scenario but get no benefit.  So yeah you have to factor in the reward for true game theory and the reward of contacting a benevolent race might outweigh everything after crunching the probabilities of scenarios based on action.  But again if that race is so powerful, it would just find us on our own sitting quietly so again say quiet still best?",1597687448,"he also makes a good point that if we stay quiet and alien contact is benevolent we still live in the quiet scenario but get no benefit.","quiet and alien","quiet",NA,FALSE,"quiet and alien","alien",NA,NA,1
"g16xx5p","I pissed my pants on my first day of 1st grade. It's a long story.

I had decided to wear overalls that day. I loved them and I wanted to make a good first impression because I'd had a lot of trouble with making friends. But my wardrobe choice bit me in the ass, hard.

You see, my mom had anxiety problems so we had regular ""stranger danger"" and ""did they touch you *there*?"" conversations. It didn't take long for that to make me afraid of all adults, especially strangers.

A few hours after class started I needed to pee. We had a bathroom attached to the classroom, so I just went in, closed the door, and started unbuttoning the fasteners on my pants. At least I tried to.

Deep down I knew I'd never be able to get my pants off on my own, but I was terrified of asking my teacher for help. I'd only known her a few hours, I wasn't about to have her help me undress in a private bathroom. But still I fought, I tried everything. I even got to the point where I would've ripped them off if I'd had the strength. If only I'd had the foresight to grab a pair of scissors as I walked over to the bathroom. But I didn't...

The teacher checked on me multiple times, but I kept sending her away. Eventually my little bladder couldn't take the pressure anymore. I tried to stop the flow once the pain wasn't so bad, thinking I could buy some time and minimize the damage to my clothes, but it was so bad at that point I just completely lost control and every drop came out. By the time it was over I was soaked from the waist down and a big puddle had formed around my feet.

My fear of asking for help intensified. The good news was I didn't have to pee anymore. Mission accomplished! The bad news was I had no clue how I was gonna cover up my accidental wetting.

I grabbed some paper towels and mopped up the mess on the floor. That was easy, at least. But I couldn't reach the sink so I couldn't rinse my pants or wash my hands. I started wringing my pants out, hoping I could hide in the bathroom until everything dried up a bit. Or until class was dismissed and everyone left.

But eventually the teacher got suspicious and demanded I open the door. I couldn't stand disappointing adults, even if (and probably because) I was afraid of them, so I complied. To her credit, she did her best to keep everything calm and quiet. But she still had to walk me through the classroom and escort me to the principal's office so I could change into some dry clothes.

I've had many days that were far worse than that one, but it doesn't change the fact that that day straight up fucking sucked.",1597216969,"to her credit, she did her best to keep everything calm and quiet.","calm and quiet","quiet",NA,FALSE,"calm and quiet","calm",NA,NA,0
"g16gc19","I’m a dude too, ballet isn’t weird on lies you really make it, and to be blunt, men belong in ballet. Art is art, and all genders are welcome, most of all in dance. In the most traditional of terms; men perform the lifts and more quiet but still important parts of ballet. This will carry over to other styles. It may not be what you’re looking for, but you will be welcome in any dance class, no matter your gender, sex, whatever. Every person has a right to move",1597203493,"in the most traditional of terms; men perform the lifts and more quiet but still important parts of ballet.","quiet but still","quiet","but",FALSE,"more quiet but still important","important","more","still",1
"g168971","Being shy, quiet, but calm and caring",1597198883,"being shy, quiet, but calm and caring","quiet, but calm","quiet","but",TRUE,"quiet , but calm","calm",NA,NA,1
