"id","txt","created_utc","corpus","match_first","TARGET","CCONJ","comma","match","ADJ","TARGET_mod","ADV","first"
"g3ex3un","I Don’t disagree with  your thinking and I’m  like that for most stuff but I don’t think my example I used is the equivalent to that.  The schwinn seems to be sturdy and quiet but cheaper than the peloton so I’m looking for those things.  Maybe it is a coffee brand or a liquor that is just as good as one with a fancy name",1598831602,"the schwinn seems to be sturdy and quiet but cheaper than the peloton so i’m looking for those things.","sturdy and quiet","quiet",NA,FALSE,"quiet but cheap","cheap",NA,NA,1
"g3ed072","But if the girl is like you, a little shy and quiet but try to talk to you ? Would it be mean to push her?
It take a lot of effort to talk to someone you know...",1598821615,"but if the girl is like you, a little shy and quiet but try to talk to you ?","shy and quiet","quiet",NA,FALSE,"shy and quiet","shy",NA,NA,0
"g3e4tm1","Lisdonagh House in Galway have converted coach houses. Really quiet but easy access to Galway city and Connemara. Stayed in December last year, loved it!",1598817949,"really quiet but easy access to galway city and connemara.","quiet but easy","quiet","but",FALSE,"really quiet but easy","easy","really",NA,1
"g3dnfwu","This, but then my mom, who usually is like super conservative about this kinda shit (and said something about how men shouldn’t look like sausages or some shit like that literally the day before) actually commented on how smooth my legs are totally catching me off guard and now I’m rambling. 
*quiet but happy trans sounds* but also still cis tho",1598810554,"this, but then my mom, who usually is like super conservative about this kinda shit (and said something about how men shouldn’t look like sausages or some shit like that literally the day before) actually commented on how smooth my legs are totally catching me off guard and now i’m rambling.  *quiet but happy trans sounds* but also still cis tho","quiet but happy","quiet","but",FALSE,"quiet but happy","happy",NA,NA,1
"g3dk8bb","I was a very smart kid, but had no motivation at all. Tired of feeling like a loser, I decided to join the Air Force. What a difference! I walked through those doors ready to hit it, and boy, did I. During my 8 years, I achieved every promotion I could on the first try.  I received performance Awards and Medals from every base at which I was stationed. And I developed a strong sense of Patriotism to our country. Of everything I received from the USAF, I am proudest of that. 

After I left the service, my sense of motivation remained with me. My first civilian job was entry-level for a large tech company. From there, in 12 years I worked my way up to being an SVP of a Fortune 500 company. Then I worked for a small tech company, and made $1M+ when they IPO'd. (really!)

My career has been quiet but steady since then, and that's just fine with me. Being an executive fed my vanity, but was not my most satisfying job. The IPO was the singular pinnacle of my financial compensation, but not my most satisfying job either.  Most satisfying will always belong where I started, as a member of the United States Air Force. They taught me everything I needed to know about motivation.",1598809210,"my career has been quiet but steady since then, and that's just fine with me.","quiet but steady","quiet","but",FALSE,"quiet but steady","steady",NA,NA,1
"g3d888x","hey i'm down to hang out some time. i'm naturally shy and quiet but if you dm me i'll reply as soon as i can. my hobbies are being human and breathing. anyway bye stay safe. cheers :)",1598803784,"hey i'm down to hang out some time. i'm naturally shy and quiet but if you dm me i'll reply as soon as i can. my hobbies are being human and breathing. anyway bye stay safe. cheers :)","shy and quiet","quiet",NA,FALSE,"naturally shy and quiet","shy",NA,"naturally",0
"g3d6lg1","Sorry that’s happening to you man, my XS is mostly fine except for it getting pretty hot on a daily basis at random times, keyboard lag, and my text and system sounds being super quiet, but other then that it’s been mostly fine. These betas effect phones in so many ways, hopefully your issues get fixed soon!",1598803042,"sorry that’s happening to you man, my xs is mostly fine except for it getting pretty hot on a daily basis at random times, keyboard lag, and my text and system sounds being super quiet, but other then that it’s been mostly fine.","quiet, but other","quiet","but",TRUE,"super quiet , but other","other","super",NA,1
"g3d0osi","I smiled.

In freshman year of high school, I was horribly depressed. I had terrible motivation, terrible self esteem, always looking for an opportunity to talk badly about myself. I needed ""permission"" from myself or others to enjoy things. It was bad.

Nothing helped, or could help. At that point in time I didn't have very many friends, either, due to the fact that I was a quiet but obnoxious weirdo.

But eventually, I decided to change. I didn't want to live in misery anymore, although I knew I couldn't just flip it like a switch. I needed to slowly, very slowly, start making changes.

So every time I passed myself in the mirror, I smiled. Not at myself, but at that *other* girl in the mirror. It was easier to cheer her up than it was to cheer myself up.

And ever so slowly, I began to cheer up more too.

Obviously that wasn't the only thing I did, but that was what started it all. A smile at the girl in the mirror. Now i'm in a much better place. I can genuinely say that I'm happy almost all the time. I've got great friends, lots of hobbies, and good grades. I'm going out and meeting new people, not staying holed away in my room.

And every time I pass my reflection, I still smile at her.",1598800329,"at that point in time i didn't have very many friends, either, due to the fact that i was a quiet but obnoxious weirdo.","quiet but obnoxious","quiet","but",FALSE,"quiet but obnoxious","obnoxious",NA,NA,1
"g3cxbwg","Name: Sara Henderson 

Nickname (if applicable):

Gender: Female

Age: 25

Occupation: Data Analysis 

Image: (Must be FaceYourManga with a *SOLID* background): [https://img.faceyourmanga.com/mangatars/2/135/2135156/large\_1864078.png](https://img.faceyourmanga.com/mangatars/2/135/2135156/large_1864078.png)

Personality: Sara is quiet but extremely intelligent 

Partner and Relationship to partner/strength of relationship:  Louis/ Estranged siblings/Sara and Louis were super close as children but were separated from each other when their parents divorced. They have not seen each other in 8 years and have no idea they are both on the show together. Will they pair up and keep their distance?

***-CHALLENGE STATS-***

General: 2

Physical: 2

Endurance: 1

Mental: 5

***-OTHER STATS-***

Strategic Ability: 5

Loyalty Level: 3

Social Skills: 3

Temperament: 5",1598798823,"name: sara henderson   nickname (if applicable):  gender: female  age: 25  occupation: data analysis   image: (must be faceyourmanga with a *solid* background): [https://img.faceyourmanga.com/mangatars/2/135/2135156/large\_1864078.png](https://img.faceyourmanga.com/mangatars/2/135/2135156/large_1864078.png)  personality: sara is quiet but extremely intelligent   partner and relationship to partner/strength of relationship:  louis/ estranged siblings/sara and louis were super close as children but were separated from each other when their parents divorced.","quiet but extremely","quiet","but",FALSE,"quiet but extremely intelligent","intelligent",NA,"extremely",1
"g3cx5fa","I had a socially awkward friend in high school. I tried to be nice to him because he had no friends and would spazz out. looking back, he probably was a high functioning autist. 

Anyway, he was generally chill and quiet but liked to talk about video games, and I always finished my math quick so I'd turn around and him him so we could talk about the games. 

well, one day he started talking about this new show he started watching. I immediately withdrew and stopped finishing my math so quick. The show he had begun to watch was My Little Pony.

He became a full on 'brony' and it got worse and worse. I have no idea where he is now, but the last I remember seeing was like 2 years after that class. I saw his facebook profile and it was entirely MLP shit with a self-made character as his profile pic.

it was awful and I feel bad for him.",1598798740,"anyway, he was generally chill and quiet but liked to talk about video games, and i always finished my math quick so i'd turn around and him him so we could talk about the games.   well, one day he started talking about this new show he started watching.","chill and quiet","quiet",NA,FALSE,"generally chill and quiet","chill",NA,"generally",0
"g3cnwzb","Where are you coming from?  How much time do you have?  What is your goal or intent?  There's a lot of things to do/see.  My goal was to get away, so I stayed away from most of the popular stuff.  It's very busy right now as everyone is vacationing closer to home.  Though with school starting, who knows.  

I downloaded iOverlander on my phone to find free places to sleep.  Stayed along Highway 2 a few nights.  Love the beaches along Lake Michigan.  It's awesome parking 10' from the lake and listening to the waves.  It sucks though because everything is always wet in the morning.  I have camped on Lake Michigan for like 10 years, and you can't avoid everything getting all wet.  I went to the beach and opened up the tent again to dry it out.  

If you go to Ottawa National Forest, I highly recommend the Sparrow Rapids campground.  It's free, right on the river (lots of fisherman), very nice and quiet.  But there are bears in the area.  

If you go to Copper Harbor, download a map of the Keweenaw before you go - you won't have any service.  But at the welcome center in town they have wifi.  If you decide to go to High Rock Bay, the short 7 mile drive takes an hour.  I had never been there previously, but the road was pretty rough.  I've seen YT videos of people driving big vans out there.  I'm not so sure how they'd fair right now.  I saw a guy in a new Tahoe turn around half way.  I had no problem, but I thought I was going to bottom out/scrape a bunch of times.  Didn't happen - though I will admit I don't have much off road experience.  

Oh, I didn't go this trip, but Black Rocks in Marquette is beautiful.  Great place to watch the sun go down.  Tahquamenon falls is cool.  Kitch-iti-kipi is nice to see.  The Soo Locks are cool if you like big ships.  It really depends what you're looking to do.",1598794082,"it's free, right on the river (lots of fisherman), very nice and quiet.","nice and quiet","quiet",NA,FALSE,"very nice and quiet","nice",NA,"very",0
"g3cl0fm","So I'm going to share my story, but first you should know I'm 14 and male and going into Year 10 (grade 10 in usa?). 
I lived in a very sheltered environment for the first 10 years of my life, and primary school was horrible, I had biased (possibly racist) teachers, I had no friends and I was used to loneliness and thought it was normal.
In 2015 at the age of 10, I moved to this new city, and this is where I was introduced to this new world of ""friends"". It's sounds weird but before then I had never considered trying to get friends. 
But this place was very different, I was introduced to ""bad language"" and my innocence and naivety separated me from the majority of the class, it also earned me several bullies. I hated this, and I had no clue what I was doing wrong. Then a new kid came, let's call him A, he also had moved, but from France and we connected instantly. He was my first friend and I really like having friends. I was introverted but I think that made me more ambiverted. After that I got more friends who also connected because I opened myself up more, but from my lonely past and bullying I had gotten social anxiety and was very insecure, I lied about a lot of things to seem more interesting to be around.
Then came secondary (high) school, and I was depressed. I felt like my whole friendship group was a lie. I also felt like A wasn't really my friend anymore, and it was emotionally exhausting for me to be around him, and this carried on for a year. Throughout year 7, I wasn't me anymore, I was someone else who was interesting and funny and fun to be around. Then comes year 8, and I felt that my friends didn't like the fake me either anymore, and I looked for attention and reassurance wherever I looked. I was lonely, I never saw my friends outside of school and felt left out.
Then came year 9 (this year). Our friendship group had expanded so much that some of the people who i had considered to be ""cool"" had actually taken a liking to us. At first I felt horrible, what if they didn't like me? Then I felt intimidated and honestly it's stupid, but true. I became very obnoxious and I think I was just a general asshole. But at the same time I was withdrawn from the group and lied a lot to impress the ""cool"" kids. This was definitely my lowest point.
Then I stopped talking to A, he was someone else now and I rarely saw him, and when we did talk he just didn't seem like the guy I knew years ago. This is when I became aware about how much I relied on others for happiness and I just stopped. I became very quiet but nice, not obnoxious or annoying, but I still remained in the friendship group.
Then came quarantine.
The first two months I was very depressed. I ate lots of shit and rarely went outside and hadn't seen anyone in ages. Then I get added to a groupchat. From that some of my friends - not the ""cool"" ones - organised to meet. Then again, and again, and again. Soon I realised how much I missed my friends. I chose to be honest with them and shared my insecurities and my past in primary. Soon I felt much closer with my friends and I felt that I knew them so much more. But i never stopped meeting them. I also got to know their insecurities and had many ""deep"" talks. Now I have found the motivation to work out at home, go on runs with my friends and regularly hang out. I've been really happy and felt that loneliness and sadness disappear. Exercise is honestly a key part of my current state and maybe you should try it too, if you're not already!

Honestly idk where I was going with this and I went a bit off topic probably but I thought you might want to know that there are better times coming, but only if you choose to get it :)",1598792476,"i became very quiet but nice, not obnoxious or annoying, but i still remained in the friendship group.","quiet but nice","quiet","but",FALSE,"very quiet but nice","nice","very",NA,1
"g3c4cao","Spurs making quiet but capable moves in the market",1598778554,"spurs making quiet but capable moves in the market","quiet but capable","quiet","but",FALSE,"quiet but capable","capable",NA,NA,1
"g3c45e3","Interesting signings, Spurs movements quiet but solid. My take: not as good of an option as at Wolves but still worth it for 6.0, Mourinho tends to have one offensive fullback and he will be that man. However playing wingback vs fullback is different and Dier or Davies + 1M is very appealing.",1598778350,"interesting signings, spurs movements quiet but solid.","quiet but solid","quiet","but",FALSE,"quiet but solid","solid",NA,NA,1
"g3bzev7","Blatant disinformation? I guess you didn't watch the video then, they literally ID'd Kyle as having pointed a gun at them and told them to get out of their car at the nearby dealership. In case you missed it, it's towards the end of the video, kinda quiet, but very clear.",1598773570,"in case you missed it, it's towards the end of the video, kinda quiet, but very clear.","quiet, but very","quiet","but",TRUE,"quiet , but very clear","clear",NA,"very",1
"g3bpwp4","hey there’s always going to be judgement. i had a crush on a guy in high school who people always said they suspect would become a school shooter. he talked to nobody and had his earbuds in, always sat alone. i had no friends at my new school so on picture day i immediately started making conversation, very awkward and quiet but he had an anime shirt so i started talking about it even though i knew jack shit about anime. people went on about how he was emo and had weird gun knowledge. i literally talked to someone and i told them i had a crush on him and they said “have fun sucking his dick that he probably cuts himself on!” one time i asked him what song he picked for the music project and he looked at me and said “pumped up kicks” at the time i was kinda shook because of the judgement but i just rolled with it, i wanted to be his friend really bad.

point was, even though this guy could may have possibly become a school shooter, there’s someone willing to bother him. i stopped bothering him eventually because i got insecure but i wish i didn’t, i knew he was a cool guy. i bet you are too. you’re gonna get judged, but some people will still appreciate you. it’s up to you if you want to change up your image.

so good thing you have friends, but if you do want to make change for a better image i suggest starting with the earbuds. i sat alone for a good chunk of freshman year listening to music until one day, i put my earbuds away and sat near a group of people. they started talking about memes then i said “i overheard you talking about memes, blah blah blah”. they’re my best friends now. they told me they were surprised and thought i was kinda weird at first but now love me and are grateful i did that weird shit. even if you suck at small talk literally talk about anything.

also, you should probably find better friends who will encourage people to think better of you than a school shooter. sorry if literally none of this makes sense, but you’re way better than what any of those people say about you.",1598765272,"hey there’s always going to be judgement. i had a crush on a guy in high school who people always said they suspect would become a school shooter. he talked to nobody and had his earbuds in, always sat alone. i had no friends at my new school so on picture day i immediately started making conversation, very awkward and quiet but he had an anime shirt so i started talking about it even though i knew jack shit about anime. people went on about how he was emo and had weird gun knowledge. i literally talked to someone and i told them i had a crush on him and they said “have fun sucking his dick that he probably cuts himself on!”","awkward and quiet","quiet",NA,FALSE,"very awkward and quiet","awkward",NA,"very",0
"g3bl7hd","For me it's Wow from A.C.E, his real name is Sehyoon. He's shy and quiet but his persona when performing is just 'wow'.",1598761704,"he's shy and quiet but his persona when performing is just 'wow'.","shy and quiet","quiet",NA,FALSE,"shy and quiet","shy",NA,NA,0
"g3bl0d1","I really like it. I initially just wanted something different and less slashable, but now that I've got it I don't think I'd turn back. It's solid and quiet, but I've read leaking can be a problem. I haven't had that issue, but I live in the desert so rain isn't much of a concern. There hasn't been a single time I've missed the soft top. When I get a stretch of nice weather I just take it off. The soft top was nothing short of annoying to me.",1598761566,"it's solid and quiet, but i've read leaking can be a problem.","solid and quiet","quiet",NA,FALSE,"solid and quiet","solid",NA,NA,0
"g3ba5tc","My wife and I had nearly this same scenario a long time ago. Our oldest was engrossed in the TV across our room. We were doing well keeping it slow and quiet, but soon got into it enough that we forgot the bed squeaked in certain directions. She looked over at us and said something when we realized we were caught. Since I was on top (missionary, covered with sheet) I slowed down but never stopped so as to seem as casual as possible and just said to go back to her show. We finished a bit quieter after that.

Since then, we just let our girls know that mom and dad  like to do grown up things together in bed and that nothing is wrong. Now they each know that there is nothing wrong and just let us have our time.",1598754666,"we were doing well keeping it slow and quiet, but soon got into it enough that we forgot the bed squeaked in certain directions.","slow and quiet","quiet",NA,FALSE,"slow and quiet","slow",NA,NA,0
"g3b94lu","I'm considering moving to Stockholm. Being Canadian I am a bit intimidated knowing about the reserved culture, more in terms of fitting in and not irritating people in Sweden. I guess being Canadian means I am pre-apologizing for something - whoops. I'm already shy and quiet, but unfortunately, I may be too forward and open to those I just met. It's important for me to ask questions, be interested in each individual I meet, and respect others while doing so. The cultural difference may make it scary for me when balancing impressions. Do you think it may be tough for a Canadian foreigner to work around these barriers? 

I think within my stress and fears of the unknown, I realize any Swedish person I had ever met has been 150% more open discussing things, being genuine and honest than most Canadians I know.",1598754045,"i'm already shy and quiet, but unfortunately, i may be too forward and open to those i just met.","shy and quiet","quiet",NA,FALSE,"already shy and quiet","shy",NA,"already",0
"g3b2fji","I’m not reading all these comments to fully understand. Point is I work in a facility that requires hearing protection and honestly it’s bs. We have 900k sq ft of manufacturing with 1800 cnc machines. 899k sq ft is relatively quiet, but corporate requirements are wear it at all time. I wear mine like this most of the time when going through the plant talking to people. I’ll set them right when it’s loud but I can’t hear any conversations with them in correctly.",1598750014,"we have 900k sq ft of manufacturing with 1800 cnc machines. 899k sq ft is relatively quiet, but corporate requirements are wear it at all time.","quiet, but corporate","quiet","but",TRUE,"relatively quiet , but corporate","corporate","relatively",NA,1
"g3ay4m4","Pretty quiet but steady. Hung around the top five most of the day, fell back on a pitstop but gained a few spots back towards the end of the race.",1598747438,"pretty quiet but steady.","quiet but steady","quiet","but",FALSE,"pretty quiet but steady","steady","pretty",NA,1
"g3ao0vj","Well your questions are more or less pretty vague

No one person has their own purpose. Basically we're put on this earth and you can't change that. Now that you exist you have existed. What you do with your existence ultimately serves a purpose.

Now you can either flail about meaninglessly with no direction, and the purpose of your existence will be muddied in the wake of your actions, as your goals will be indistinguishable from each individual choice.

Or you can serve a purpose that guides your actions.

So you can either serve a direction and propel yourself in that direction, or chaotically flounder like a fish out of water until you have no breath left.

It all depends on your individual characteristics which one may best suit you, but generally I find that a peaceful life is a happy life. I don't mean peaceful as in quiet, but peaceful as in not resisting life.


Anyhow you're a little young for an existential crisis don't you think? Either way good luck with yourself. Life always changes, no better no worse, it's just gonna be different every few years.",1598742179,"i don't mean peaceful as in quiet, but peaceful as in not resisting life.","quiet, but peaceful","quiet","but",TRUE,"quiet , but peaceful","peaceful",NA,NA,1
"g397hyb","yo this is pretty sick! i think my only complaints might only be mixing, but only super small things. like maybe the beat could be a lil heavier, and the second person who coms in seems a little more quiet, but other than that yall got a nice flow and the emotion behind your voices. It just feels a little thin cause the beats a little quiet

keep it up!",1598719413,"i think my only complaints might only be mixing, but only super small things. like maybe the beat could be a lil heavier, and the second person who coms in seems a little more quiet, but other than that yall got a nice flow and the emotion behind your voices.","quiet, but other","quiet","but",TRUE,"more quiet , but other","other","more",NA,1
"g38nt6r","And that’s why tacticians study ever war. Even into antiquity. I remember my 5th grade history teacher explaining Roman tactics, and how he applied some of them as an LLRP in Vietnam. He had just come back after two tours. 

Short guy, quiet, but very focused and very accurate with an eraser even at 6 meters.",1598708992,"short guy, quiet, but very focused and very accurate with an eraser even at 6 meters.","quiet, but very","quiet","but",TRUE,"quiet , but very focused","focused",NA,"very",1
"g38mqqa","Artsy, shy and quiet but fun to be around once people get to know you.",1598708296,"artsy, shy and quiet but fun to be around once people get to know you.","shy and quiet","quiet",NA,FALSE,"quiet but fun","fun",NA,NA,1
"g38g4h5","I don't have any advice but I can relate heavily lol. I'm normally super shy and quiet but I've been told that I'm really fun and carefree when I'm drunk. It kind of got me down for a bit till I realised that drunk me is still me at the end of the day. And as long as I work on my anxiety and stop overthinking things then I can be that person minus the alcohol one day :)
All the best with everything!",1598703558,"i'm normally super shy and quiet but i've been told that i'm really fun and carefree when i'm drunk.","shy and quiet","quiet",NA,FALSE,"super shy and quiet","shy",NA,"super",0
