"id","txt","created_utc","corpus","match_first","TARGET","CCONJ","comma","match","ADJ","TARGET_mod","ADV","first"
"g0ld7t2","your message was to me and I found it both hilarious and crystal clear, ignore the reactionaries lol

There's a quiet but obnoxious war all across reddit between people who call every post fake and people who find that frustrating.",1596740098,"your message was to me and i found it both hilarious and crystal clear, ignore the reactionaries lol  there's a quiet but obnoxious war all across reddit between people who call every post fake and people who find that frustrating.","quiet but obnoxious","quiet","but",FALSE,"quiet but obnoxious","obnoxious",NA,NA,1
"g0l0udy","Going against the grain here: YTA (gently)

Your sleep deprivation likely is the symptom of some larger cause. Her doing normal human things is not her torturing you. Have you sought medical advice?

She was loud, you asked her quiet, she acknowledged that. Now you didn't make it clear, but is she being more quiet but still able to wake you? In that case, it's not how she's doing it, it's the fact it's happening and you cannot hold another person hostage because it makes you comfortable. If her behaviour remained exactly the same, then I'd change my mind, but based on the post she doesn't seem to be that kind of person.",1596734898,"now you didn't make it clear, but is she being more quiet but still able to wake you?","quiet but still","quiet","but",FALSE,"more quiet but still able","able","more","still",1
"g0kwpul","Well, I don't really care if they like me or not, it's more that I'm trying to communicate my personality without words. If I dress like someone from the 1950's that says something different about me than if I dress like someone from the Grunge era, or a goth, or a fashionista, and so on. My sister wears 1950's style dresses because she likes how they look and it conveys her personality pretty well. (she's sweet and quiet, but a fun person to be around if you can draw her out of her shell) It's easy to shop for because she just googles ""1950's dress"" and picks out what she likes. It makes her stand out a little bit from the crowd and gives a nice friendly impression which helps her with people because she's such a massive introvert.",1596732988,"my sister wears 1950's style dresses because she likes how they look and it conveys her personality pretty well. (she's sweet and quiet, but a fun person to be around if you can draw her out of her shell) it's easy to shop for because she just googles ""1950's dress"" and picks out what she likes.","sweet and quiet","quiet",NA,FALSE,"sweet and quiet","sweet",NA,NA,0
"g0krrjj","IIRC he's been stated to just be a quiet but nice dude who makes friends easily.

He's just kind hearted. Half the rivals aren't actually in love with him, his sister is literally his sister, the teacher is a rapist, the nurse is senpais crush, and megami is just protecting him i think?

I don't really mind him that much. Over half the world has dark hair and eyes so.
 He's got a boring backstory but then again it's just Yansim, after all. Alex can't write.

Also you can't really tell the difference between any of the other characters anyway besides the hair. Everyone is the same exact model.",1596730798,"iirc he's been stated to just be a quiet but nice dude who makes friends easily.","quiet but nice","quiet","but",FALSE,"quiet but nice","nice",NA,NA,1
